Title,Company,Location
Backend Programmer,Baru!,Lembaga Layanan Pendidikan Tinggi Wilayah IX
Programmer Backend,Baru!,PT Alfahuma Rekayasa Teknologi
Backend Programmer,Baru!,PT Nusa Tekno Global
Backend Developer,Baru!,PT Cobra Dental Indonesia
Backend Developer - IT Business Application,Baru!,PT Surya Citra Media Tbk
Backend Developer - IT Business Process & Project,Baru!,PT Surya Citra Media Tbk
Backend Developer Intern,Baru!,PT Fintek Karya Nusantara
Backend Developer Support,Baru!,PT Metra-Net
Backend Developer (Web & Mobile Apps),Baru!,PT Imajiku Cipta Media
Backend Developer,Baru!,Perkumpulan Sosial Ekonomi Akselerator Lab
Telkomsel Software Development Intern - BackEnd Engineer,Baru!,PT Telekomunikasi Selular
Telkomsel Software Development Intern - BackEnd Engineer,Baru!,PT Telekomunikasi Selular
Backend Engineer Intern,Baru!,PT Modular Kuliner Indonesia
Backend Developer,Baru!,PT Elang Mahkota Teknologi Tbk
FIF - Backend Developer,Baru!,PT Astra International Tbk
FIF – Backend Java Spring Boot ,Baru!,PT Astra International Tbk
FIF – Backend Developer ,Baru!,PT Astra International Tbk
FIF - Backend Java Spring Boot,Baru!,PT Astra International Tbk
SERA - Backend Developer,Baru!,PT Astra International Tbk
FIF - Backend Java Spring Boot,Baru!,PT Astra International Tbk
Backend Developer of CTARSA Foundation,Baru!,PT Trans Digital Media
Backend Engineer,Baru!,PT Adma Digital Solusi
Backend Engineer,Baru!,PT Adma Digital Solusi
Backend Developer,Baru!,PT Bukit Vista Nusantara
Backend Developer,Baru!,PT Suitmedia Kreasi Indonesia
Backend,Baru!,PT Widya Inovasi Indonesia
Backend Engineer Intern,PT Home Credit Indonesia,Kota Jakarta Selatan (WFO)
Backend Engineer Intern,PT Home Credit Indonesia,Kota Jakarta Selatan (WFO)
Software Engineer (Backend) - Intern,PT Semesta Integrasi Digital,Kota Jakarta Selatan (WFO)
